post_title,post_name_en,post_content,post_status,post_type,location,operating_org,project_link,geographic_region,recruitment_cycle,target_audience,latitude,longitude,coordinate_source
נוער מוביל תרבות,Youth Culture Leadership Program,"נוער מוביל תרבות היא תוכנית שנתית לטיפוח בני ובנות נוער בעלי זיקה לתרבות ולאמנות, במטרה להכשירם כיזמים/ות ומנהיגים/ות בתחום. במהלך התוכנית המשתתפים זוכים להיכרות מעמיקה עם עולם התרבות באמצעות מפגשים עם יוצרים, סדנאות, הרצאות וסיורים, ולומדים כיצד להוציא לפועל יוזמות תרבות מהרעיון ועד הביצוע.",publish,project,"מקום לשירה: סירקין 5, חיפה",מקום לשירה & דרך רוח,https://bit.ly/4gFUONC,כרמל,מחזור ו,נוער וילדים | אנשי מקצוע ופעילים,32.800626,35.002014,
חינוך לשותפות - רשויות שכנות,Education for Partnership - Neighboring Municipalities,"תוכנית ""חינוך לשותפות"" מחברת בין רשויות יהודיות וערביות סמוכות בנגב ליצירת אמון והבנה הדדית בקרב הנהגות ואנשי חינוך. השלב הבא במיזם מרחיב את הפעילות למפגשים ישירים בין תלמידים בבתי הספר לקידום סובלנות וחיים משותפים.",publish,project,רהט + מ.א. בני שמעון + מרחבים ערד + כסיפה רח'מה + ירוחם,אג'יק - מכון הנגב,https://ajeec-nisped.org.il/?page_id=16336,דרום,מחזור ו,נוער וילדים | אנשי מקצוע ופעילים,31.362759,34.743899,
מסע בית הלל,The Bus,"קבוצה של דתיים וחרדים, נשים וגברים, תצא למסע ישראלי משותף לבניית שיח ישיר ולמידה משותפת על קבוצות וסוגיות מרכזיות בהוויה הישראלית",publish,project,רחבי הארץ,ארגון רבני ורבניות בית הלל,https://beithillel.org.il/,מרכז,מחזור ו,דתיים וחילונים | אנשי מקצוע ופעילים,31.862965,34.782832,
חברה משותפת - המודל המקומי,Shared Society  -The Local Model,מספקים לרשויות כלים מעשיים ומסגרת מלווה לקידום יחסי ערבים-יהודים סביב סוגיות היום-יום,publish,project,רחבי הארץ,שיטה - מכון למדיניות מקומית,https://shittah.org/,מרכז,מחזור ו,יהודים וערבים,32.230375,34.906956,
כפר סטודנטים יהודי-ערבי,Jewish-Arab Students' Village,"כפר הסטודנטים היהודי ערבי בבאר שבע מבקש לנצל את ההזדמנות הייחודית של השלב הסטודנטיאלי בו יהודים וערבים יושבים זה לצד זה על ספסל הלימודים בכדי ליצור היכרות, דיאלוג מעמיק ושותפות במרחבי פעולה שונים.",publish,project,באר שבע,דרכים,https://hechalutz.com/programs/studenttogether/,דרום,מחזור ו,צעירים וסטודנטים | יהודים וערבים,31.271514,34.773421,
יוצרים עתיד: חינוך אזרחי לדמוקרטיה בהכשרה להוראה,Shaping the Future: Civic Education for Democracy in Teacher Education,"מיזם ""יוצרים עתיד"" מכשיר אנשי חינוך לקידום חברה אזרחית מעורבת דרך מפגש בין סטודנטים להוראה מכלל המגזרים. יחד, הם פועלים בזירה חינוכית משותפת לעיצוב פני החברה ולחיזוק המרקם החברתי בישראל.",publish,project,כל הארץ,בר קיימא,https://www.facebook.com/profile.php?id=61571704450666,מרכז,מחזור ו,צעירים וסטודנטים,31.825432,34.844561,
"מועדון האופניים הקהילתי ""המסלול יפו""",Ha-Maslul Jaffa – community cycling club,"מועדון האופניים הקהילתי ""המסלול יפו"" – המועדון הינו גשר מקצועי לענף ספורט האופניים עבור קהילת תושבי יפו והסביבה, מרכז פעילות פנאי ומרחב חינוכי לתוכניות רכיבה והכשרה לילדים, בני נוער ומבוגרים מכל קשת האוכלוסייה",publish,project,נמל יפו,חץ ומטרה (המסלול ),https://www.hamaslul.com/,מרכז,מחזור ו,נוער וילדים | נשים | יהודים וערבים,32.040365,34.770048,
אנסמבל הנוער של הגליל של תזמורת ירושלים מזרח ומערב,The Galilee Youth Ensemble – Jerusalem East & West Orchestra”,"מיזם מוזיקלי של תזמורת ירושלים מזרח ומערב המטפח מצוינות ושותפות בין נוער יהודי וערבי בגליל המערבי. המשתתפים לומדים שפה מוזיקלית המשלבת מזרח ומערב, תחת הנחיית נגני התזמורת, בדרך לקונצרט משותף בעכו.",publish,project,",ירושלים, באר שבע, יפו, צפון אזור הגליל המערבי – ועכו.",תזמורת ירודשלים מזרח ומערב,https://www.jerusalem-orchestra.co.il,צפון,מחזור ו,נוער וילדים | יהודים וערבים,32.88583,35.168324,
מובילות חיבור,Women Leading Connection,"מובילות חיבור' פועלת לפיתוח מנהיגות נשית מגשרת, שתפעל לקידום לכידות חברתית באמצעות קורסי גישור רב-תרבותיים, סיורים, ליווי ארגונים בתהליכי גיוון והכללה ומנטורינג בין-תרבותי. החזון: נשים ממגזרים שונים מובילות לצמצום הקיטובבחברההישראלית",publish,project,ארצית,קמח קידום מקצועי חרדי,http://www.movilot.org.il/,מרכז,מחזור ו,נשים | דתיים וחילונים,,,
גשרים של הכרות,Bridges of Understanding,"פעילויות גיבוש וחיבור בין שני המגזרים להורדת מחסומים, חששות ויצירת הכרות",publish,project,לוד,הקרן לפיתוח לוד,https://www.lodfoundation.org/,מרכז,מחזור ו,נוער וילדים | יהודים וערבים,31.967555,34.90707,
זורנא - קולקטיב ארטיביסטי יהודי ערבי לתרבות ולשינוי,Zurna,"זורנא מאגדת ארגוני תרבות ואמנים יהודים וערבים לקידום חיים משותפים בישראל.הקהילה מפתחת רשת מקצועית, מאגר נתונים, שיתופי פעולה ופעולות ציבוריות לשינוי תרבותי וחברתי.",publish,project,"פעילויות מתקיימות בפריסה רחבה ברחבי ישראל, בדגש על ערים מעורבות (תל אביב - יפו, ירושלים, חיפה וכו').",מרכז פליציה בלומנטל למוסיקה,https://www.idantoledano.com/zurna,מרכז,מחזור ו,יהודים וערבים | אנשי מקצוע ופעילים,32.040874,34.759576,
"שיפור מערכות יחסים בחברה מגוונת ומקוטבת בדרך ה-U; התוכנית: ""לפלס דרכים""",Paving the Way:Equipping Israel’s Civic/Social Leaders with the Tools to Bridge Divides,,publish,project,"הקורס נערך בתל אביב, בהשתתפות ארגונים מכל הארץ",,,מרכז,מחזור ו,אנשי מקצוע ופעילים,,,
ספריה דו לשונית ערבית – עברית בלוד לעידוד קריאה בגיל הרך,Bilingual Library for Children in Yeruham - Rahma,,publish,project,טיפת חלב ירוחם המשרתת משפחות בכפר הלא מוכר רחמה,,,דרום,מחזור ו,קהל מגוון,30.992918,34.934345,
עוטף דג- כיתות האמן הטיפוליות של 100 דגים- הדג נחש,Hadag embraces,,publish,project,"יישובי עוטף עזה, צפון, שרון, מרכז",,,דרום,מחזור ו,נוער וילדים,31.455773,34.546861,
אדבר איתך - שתי שפות. אהבה אחת.,I Shall Speak to You,,publish,project,רחבי הארץ,,www.rev-orch.com,מרכז,מחזור ו,נוער וילדים,,,
מכוונים גאווה,Kivunim Pride,,publish,project,"חיפה ,מרכז וזום (קבוצה ארצית)",,,כרמל,מחזור ו,"להט""ב | מוגבלויות | צעירים וסטודנטים",,,
מעגלי נשים סבאיא,Sabaya circles,,publish,project,חיפה,,,כרמל,מחזור ו,נשים | יהודים וערבים,,,
הכשרת מנחים ופיתוח תוכן להפחתת דעות קדומות וגזענות,Facilitators Training and Developing Content to Reduce Prejudice and Racism,,publish,project,תוכן הסדנאות להפחתת גזענות מופעל באופן ארצי רחב,,,מרכז,מחזור ו,נוער וילדים | אנשי מקצוע ופעילים,,,
בניית שדה השיח הבין-דתי בישראל,Building the field of interfaith and Middle Eastern dialogue,,publish,project,"ישראל והמזרח התיכון, המטה נמצא בירושלים",,,ירושלים,מחזור ו,אנשי מקצוע ופעילים,,,
נשות הדבש של נחל ציפורי,The Honey Women of the Tzipori Strem,,publish,project,מגוון ישובים בנחל ציפורי,,,צפון,מחזור ו,נוער וילדים | נשים,32.749551,35.206871,
"חמ""ל התרבות בנגב – מקדמים תרבות משותפת",,,publish,project,,,,דרום,מחזור ו,קהל מגוון,31.386117,34.671278,
"בוניה (bunya) ) – לומדים לתקשר, להכיר ולהתחבר",Bunya,,publish,project,ירושלים,,,ירושלים,מחזור ו,אנשי מקצוע ופעילים,,,
