post_title,post_name_en,post_content,post_status,post_type,location,operating_org,project_link,geographic_region,recruitment_cycle,target_audience,latitude,longitude,coordinate_source
Migvanim: a multicultural dialogue in the neighborhoods of south Tel Aviv,שכונת שפירא - במרכז הקהילתי,"From the initiative of a participant in the program, following the events and the extremism in the discourse in society, a forum 'We are brothers' was established in which community leaders participate. Dialogue meetings and a meetings between residents who come from different worldviews were initiated, out of a choice to engage in connection, meeting and conversation. In addition, a series of neighborhood tours was initiated from the multicultural angle that represents the place.",publish,project,Shapira neighborhood – Community Center,The Pardes organization,,מרכז,מחזור ג,דתיים וחילונים,32.05147,34.77528,
תוכנית התיכונים למנהיגות ובמשפט,Program of high schools for leadership and law,"התוכנית מציעה חלופה ללימודי האזרחות הסטנדרטיים עבור תלמידי י""ב, ומפגישה בין קבוצות ומגזרים שונים בחברה הישראלית לשיח מעמיק. הלמידה כוללת כתיבת אמנה משותפת ומהווה בסיס למטלת הביצוע באזרחות בתיאום עם משרד החינוך",publish,project,רמת גן,אוניברסיטת בר-אילן,,מרכז,מחזור ד,נוער וילדים | יהודים וערבים,32.069017,34.843603,
אקלים של אחדות,Climate of Unity,"מיזם המחבר בין קהילות סביב משבר האקלים לחיזוק הסולידריות החברתית דרך למידה, עשייה משותפת ומנהיגות. הפעילות כוללת בניית קהילות מעורבות, אירועי תרבות ושיח סביבתי-ערכי המהווה בסיס לחיבור חיובי בחברה הישראלית.",publish,project,"ירושלים, באר שבע וחיפה- במרחבים הציבוריים",טבע עברי,,ירושלים,מחזור ד,צעירים וסטודנטים | אנשי מקצוע ופעילים,31.779247,35.214493,
חברותא בסלון,Salon Hevruta,"מיזם לקידום קשרים אישיים בין חרדים לחילונים באמצעות מפגשים בחינוך, באקדמיה ובקהילה. הפרויקט מתמקד באירוח נשים בבתים ליצירת תחושת קרבה ומעורבות, ומטרתו לבסס קבוצות שיח קבועות המקדמות סובלנות ואכפתיות בחברה הישראלית.",publish,project,בכל רחבי הארץ- סלונים,איילת השחר,,מרכז,מחזור ד,נשים | דתיים וחילונים,31.893471,34.816868,
"מרכז ""ניסאן"" במכון ון-ליר",“Nisan” Center at the Van Leer Institute,"פיתוח מסגרת מושגית ואנליטית עבור ארגוני חברה אזרחית העוסקים ביחסי יהודים-ערבים. המיזם כולל כתיבת לקסיקון של 30 מונחי יסוד על ידי חמישה ארגונים משותפים, ועריכת סמינרים להטמעת המושגים והפצתם באופן דיגיטלי.",publish,project,"במקומות שונים: עכו, לוד, נווה שלום, גבעת חביבה, מכון ון ליר.",מכון ון ליר,,ירושלים,מחזור ד,יהודים וערבים | אנשי מקצוע ופעילים,31.769915,35.21539,
מרכז חדשנות אזורי לקיימות חברתית jacahub: Jewish-Arab Carmel Area Hub,Regional Innovation Center for Social Sustainability,"מרחב יזמות ועבודה רב-תרבותי לתושבי חוף כרמל, פורדיס וזיכרון יעקב, המהווה פלטפורמה לפיתוח סטארטאפים טכנולוגיים וחברתיים. המיזם מקדם קיימות חברתית ופתרונות עסקיים לצעירים דרך עבודה משותפת, מכינה ותוכנית אקסלרטור.",publish,project,"זכרון יעקב ובפוריידיס, חוף הכרמל וג'יסר א-זרקא",זמארין העמותה לתרבות פנאי וקהילה זכרון יעקב,,כרמל,מחזור ד,יהודים וערבים | אנשי מקצוע ופעילים,32.561231,34.930343,
נפגשים בשבילי אברהם אבינו,Meeting in the Path of our Father Abraham,"הנגשת המשותף והבנת השונה בין החברה הדתית-חרדית לחברה הערבית דרך למידה תרבותית ושפתית. המיזם כולל תוכניות הכשרה, סיורים וסדנאות משותפות במיקומים שונים בארץ, במטרה לבסס קשרים בני קיימא וליצור קהילה משותפת.",publish,project,"בכל רחבי הארץ- לוד בני ברק (מודיעין עלית ) וירושלים . כמו כן, ביישובים ערביים שונים בארץ - מזרח ירושלים, אבו גוש, יפו, לוד, כוחלה (נגב), שפרעם וג'לג'וליה.",מכון חכמת התורה,,ירושלים,מחזור ד,יהודים וערבים,31.789647,35.205356,
עיוני – קבוצת תיאטרון לנשות רהט ונשות שדרות,,,publish,project,,,,דרום,מחזור ד,יהודים וערבים | נשים,31.531135,34.615277,
שוף אל נוף - מיזם טיולים משותפים,Shuf al Nuf – Joint trips for Arabs and Jews,"פיתוח מסגרת קהילתית בין-תרבותית לבוגרי תוכניות הדיאלוג של ""מבט"" באקדמיה דרך למידה משותפת ונטוורקינג. המיזם כולל סיורים עירוניים וטיולי שטח חווייתיים המשלבים תרגול שפות (עברית, ערבית ואנגלית) ואירוח בקהילות המוצא לחיזוק הסובלנות.",publish,project,בכל רחבי הארץ- סיורים בגליל חיפה ירושלים ובאר שבע נגב,עמותת מבט,https://www.mabat.org/%D7%A9%D7%95%D7%A3-%D7%90%D7%9C-%D7%A0%D7%95%D7%A3/,כרמל,מחזור ד,יהודים וערבים,32.627769,34.943788,
קואליציית המנהיגות של עכו,Acco Leadership Coalition,"הקמת קואליציה מקומית לקידום חברה משותפת ורישות פעילויות לאורך השנה בהשראת ""המודל הירושלמי"". המיזם כולל הכשרות מקצועיות, יוזמות שטח (Grassroots) ושינוי מדיניות מול הרשות, במטרה לבנות תשתית של אמון ומוכנות לזמני חירום.",publish,project,עכו,מרכזים לצדק חברתי,,צפון,מחזור ד,מוגבלויות | יהודים וערבים | אנשי מקצוע ופעילים,32.92747,35.085528,
חלקי,,,publish,project,,,,מרכז,מחזור ד,קהל מגוון,,,
בין השמשות - המרכז לתרבות המחלוקת,Twilight – Center for Culture of Dispute,"מרכז לפיתוח שיח מתוך מחלוקת המבוסס על מודל החיים המשותפים ביישוב שיזף. המיזם מציע סיורים, פאנלים עם תושבים וסדנאות חקירה המפגישים בין דתיים וחילונים סביב פערים בחברה הישראלית, במטרה לטפח תרבות שיח בונה ומקרבת.",publish,project,יישוב שיזף,מיתרים - רשת קהילות וחינוך יהודי משלב,,דרום,מחזור ד,נוער וילדים | נשים | יהודים וערבים,31.002194,34.766589,
מי שחיפש מצא ומי שזרע קצר,,,publish,project,,,,מרכז,מחזור ד,קהל מגוון,,,
מכוונים גאווה,Directed Toward Pride,"הקמת קבוצות שייכות ותמיכה לצעירים עם מוגבלות מהקהילה הגאה, כחלק מתהליך גיבוש זהות עצמאית במכינות ""כיוונים"". המיזם כולל מפגשים דו-שבועיים בצפון ובזום, בשילוב אירועים ארציים וחיבור לארגוני להט""ב קיימים. הפעילות מיועדת לחניכים, בוגרים וצוות הארגון לחיזוק המעטפת הקהילתית והחברתית.",publish,project,"חיפה מרכז ""אזימוט"" וקבוצות ארציות באיזור המרכז",כוונים-עמותה לקידום צעירים עם צרכים מיוחדים בישראל,,כרמל,מחזור ד,"להט""ב | מוגבלויות | צעירים וסטודנטים",32.817744,34.992031,
מעגל סבאיא – מעגל נשים בגליל העליון,,"יצירת פלטפורמה למפגש ושיח אינטימי בין סטודנטיות יהודיות, ערביות ודרוזיות בפריפריה, המדגישה את המשותף על פני השונה. התוכנית כוללת מפגשים שבועיים, סיורים וסמינרים הפועלים במודל תלת-שלבי: הבנת האתגרים, גיבוש מנהיגות משותפת והקניית כלים להובלת שינוי חברתי ומעורבות אזרחית.",publish,project,מכללת תל חי,עמותת דרכים,https://hechalutz.com/programs/sabaya/,צפון,מחזור ד,נשים | יהודים וערבים,33.236432,35.5792,
מעגלי חיכאיאת (סיפורים),Story Circles,"הכשרת נשים יהודיות וערביות בגליל כמספרות סיפורים דו-לשוניות לילדים, במטרה לעצב תודעה רב-תרבותית מגיל צעיר. המיזם כולל כתיבת סיפורים חינוכיים בליווי פדגוגי והקמת ספרייה דיגיטלית לתיעוד הסיפורים המקומיים. דרך כלי ה-Storytelling, המשתתפות בונות עתיד משותף ומשפיעות על הדור הבא באמצעות שפה וזהות.",publish,project,"קליקה"" אזור תעשיה משותף לסכנין-משגב, תרדיון","דיאלוג - אדם, סביבה ומדע",https://hikayat.co.il/,צפון,מחזור ד,נשים | יהודים וערבים,32.867641,35.273358,
נוער מנהיג שינוי בנחל,Youth Leading Change in the Nahal,"תוכנית מפגשים לתלמידים יהודים, צ'רקסים וערבים המבוססת על היכרות עם המרחב הפתוח והנחל הסמוך לביתם. המיזם כולל נבחרת מנהיגות נוער משכבות ח' המשתתפת ב-10 מפגשים חווייתיים, הכוללים חקר טקסטים מהמקורות וסדנת צילום משותפת. הפעילות שואפת לחזק את תחושת השייכות והשותפות במרחב ולייצר דיאלוג משמעותי דרך למידה ועשייה בטבע.",publish,project,אגן נחל תבור - בדגש על עין קאזאן ונחל השבעה,המוזיאון הארכיאולוגי בקיבוץ עין דור,https://eindormuseum.co.il/,צפון,מחזור ד,נוער וילדים,32.656941,35.417116,
נעות,Naot – Ma’ba’ad,"סדרת סדנאות מחול ותנועה דו-לשוניות לנשים ערביות, נוצריות ויהודיות ביפו, המשלבת מפגשים עם אמניות מעוררות השראה. המיזם משתמש בגוף ככלי ליצירת ערוצי דיאלוג חדשים ומרחב מוגן לעיסוק בנושאי זהות, נשיות ושותפות. הפעילות שואפת להעצמה אישית וקהילתית, ומסתיימת במפגש עם קבוצות נשים מיישובים מעורבים נוספים לחיזוק הקשרים.",publish,project,"סטודיו יסמין גודר השוכן במרכז תרבות מנדל, בתל אביב. בנוסף לאירועים מיוחדים כמו סיור ביפו, או נסיעה למפגש עם קבוצות נשים נוספות בישובים מעורבים",להקת יסמין גודר,https://www.yasmeengodder.com/he/%D7%A0%D7%A2%D7%95%D7%AA-%D9%85%D8%B9-%D8%A8%D8%B9%D8%B6/,מרכז,מחזור ד,נשים | יהודים וערבים,32.051055,34.760068,
על המקאם הזה: אמנות התרגום כאפשרות למפגש,On the radar: The art of translation as an opportunity for encounter,"תוכנית שנתית למשוררים יהודים וערבים מאזור הצפון, המקדמת דיאלוג פואטי דרך מלאכת התרגום. המשתתפים לוקחים חלק ב-12 מפגשים של העמקה בסוגיות תרגומיות ועבודה על טקסטים אישיים וקבוצתיים. הפרויקט מגיע לשיאו במופע רב-תחומי ב""חג של החגים"" בבית הגפן ובהפקת ספר יצירות דו-לשוני.",publish,project,"מרכז ""מקום לשירה"" -שוק תלפיות חיפה",מקום לשירה,https://www.poetryplace.org/events/elementor-19109/,כרמל,מחזור ד,יהודים וערבים,32.810757,34.999884,
שיח נשי יהודי מוסלמי,Jewish Muslim Women’s Dialogue,"הקמת קבוצות נשים דתיות בלוד, רמלה ועכו ליצירת מודל של שכנות מכבדת וסובלנית בערים מעורבות. התוכנית כוללת 10 מפגשי לימוד ושיח על סוגיות דתיות משותפות ואתגרים במרחב המשותף, לצד סדנאות וטיולים. בסיום הפרויקט, המשתתפות מובילות יוזמה חברתית או חינוכית בעירן לקידום ערכי כבוד הדדי והיכרות בין הקהילות",publish,project,"לוד, רמלה, מרכז צעירים עכו- מתנ""סים מקומיים",מרכזי הגישור בקהילה- גמעיית אל הודא רמאלה,,מרכז,מחזור ד,נשים | יהודים וערבים,31.943592,34.884855,
דיאלוג בין תרבויות מוזיקליות,Intercultural Musical Dialogue,"תוכנית שנתית המפגישה סטודנטים יהודים וערבים ללימוד יצירות קלאסיות והוראתן בבתי ספר משני המגזרים. המיזם כולל מחנה מוזיקלי עם לינה ופעילויות חברתיות לילדים, המאתגרות אותם לתקשר מעבר למחסום השפה. הפרויקט מגיע לשיאו בקונצרט משותף באקדמיה בירושלים, בו מבצעים הסטודנטים והילדים עיבודים תזמורתיים שנכתבו במיוחד עבור המפגש הרב-תרבותי.",publish,project,"קלנסווה, כפר יונה, חבל אילות",מתנ״ס חבל אילות,,דרום,מחזור ד,נוער וילדים | יהודים וערבים,29.892021,35.063685,
הקמת בית-ספר רב-תרבותי צומח בגליל המערבי: שלב א',Establishing the Western Galilee Intersection multi-cultural school– Stage 1,"ביסוס שותפות קהילתית בין קיבוץ עברון לכפר מזרעה דרך חינוך דו-לשוני ופעילויות פנאי משותפות. המיזם מקדם ערכים של סובלנות וערבות הדדית כמענה למתחים ביטחוניים, ובנה תשתית של אמון המונעת אלימות במרחב האזורי. כעת, העמותה פועלת להקמת כיתה א' דו-לשונית ראשונה (תש""פ), תוך הרחבת המודל לישובים נוספים בגליל המערבי.",publish,project,"קיבוץ עברון - המטה ובתחומי מועצת מטה אשר , מזרעה, עכו , נהריה והסביבה שבגליל המערבי",חיים ביחד - עמותת הגן הדו-לשוני מזרעה עברון,,צפון,מחזור ד,נוער וילדים | יהודים וערבים,32.988543,35.102034,
יצירת מרחב לשיח ושיתוף פעולה בבסמת וקרית טבעון,Creating space for dialogue and collaboration in Basmat Tab’un and Kiryat Tivon,"תוכנית להפגת זרות ובניית אמון בין תושבי קריית טבעון ובסמת טבעון באמצעות שיקום ""שביל הזעתר"" המחבר בין היישובים. המיזם כולל פעילות משותפת של תלמידי חטיבות ביניים לשדרוג המרחב הציבורי, בליווי רכז דיאלוג ייעודי ממרכז הגישור הקהילתי. הפרויקט יתועד בווידאו ויופץ ברשתות החברתיות כדי לקדם תחושת ביטחון ושותפות במרחב החיים המשותף.",publish,project,קרית טבעון ובסמת טבעון,"רשת מתנ""סים קרית טבעון",,כרמל,מחזור ד,נוער וילדים,32.713184,35.125938,
סיורים מספרים,Telling Tours,"מיזם המשתמש במקורות המים בעמק המעיינות כפלטפורמה להפגת מתחים היסטוריים וחיזוק הקשר בין תושבי בית שאן למועצה האזורית. המיזם כולל סדרת סיורים לוותיקי האזור סביב אתרי מים שונים, המלווים במעגלי הידברות ותיעוד סיפורים אישיים. הידע שנאסף יונגש באתר אינטרנט ייעודי למטיילים ולקהל הרחב, במטרה להפוך את המתיחות רבת-השנים לשיח של שותפות והיכרות.",publish,project,עמק המעיינות ובעיר בית שאן,מרכז קהילתי בית שאן,,צפון,מחזור ד,קהל מגוון,32.496284,35.49701,
Blend.Arabicבלנדר - המודל הארצי - מדברים באמת,Blend.Ar,"הפעילות וקהילת הבוגרים גדלה (כ-1,000 משתתפים בשנה). הפעילות התרחבה לאזורים גיאוגרפים נוספים ברמה הארצית מחוץ לאבו גוש וכן נוספו מוטבים חדשים - צעירים ערביים שמקבלים התמחות, תכנית מנטורינג והזדמנויות נטוורקינג משמעותיות",publish,project,"אבו גוש, ירושלים, יפו, נווה שלום",בלנדר,www.blenarabic.com,ירושלים,מחזור ד,יהודים וערבים,31.806903,35.112253,
הינשוף קידום אומנות רב תרבותית בלוד ככלי לטוב משותף,The Owl – a local art and culture magazine,המיזם עד כה פעל וממשיך בעיר לוד והשלים 3 מחזורי פעילות ויצאו 3 מגזינים במסגרת פרוייקט הינשוף. המטרה להרחיב את פעולת המיזם ל-2 ערים נוספות ולהרחיב את מודל הפעולה לסדנת אמנים בתחום הכתיבה/ האמנות הפלסטית/ הצילום במטרה ליצור מפגש משמעותי ומפרה בין האמנים מהמגזרים השונים וכן לבנות כלים לפיתוח האמנים והאמנות בפריפריה ככלי לביטוי והבעה של התרבויות המרכיבות את המרקם החברתי בכל עיר,publish,project,"מיזם רשת קהילות בני מקום פועל ב- 12 יישובים ברחבי הארץ, אנו מעוניינים להרחיב את העשייה וליישם את המודל שנבנה בלוד בשלוש ערים בהם פועלת הרשת. לוד, נתניה ואופקים.","חברי קהילת ""תא דואר לוד""                         מיזם רשת קהילות בני מקום, מרכז הצעירים בלוד",https://www.2link.co.il/flipbook/lod-rtl,מרכז,מחזור ד,צעירים וסטודנטים,31.964169,34.873295,
ירושלמית מדוברת,Spoken Jerusalem,"הרחבת הפעילות לקהלים נוספים מחוץ לי-ם. פיתוח קורס עברית וערבית ייחודיים עבור קהלים מגוונים במגזר העסקי והציבורי; תכניות לימוד לשילוב א.נשים מהחברה הערבית באקדמיה ובתעסוקה; וסדנאות לקהלים שונים מרחבי הארץ ומחו""ל המספרות את סיפור הקהילה ומקדמות ערכים של שותפות, סולידריות ועשייה אזרחית.",publish,project,ירושלים -מוסללה מרכז העיר,כולנא ירושלים,https://www.facebook.com/YerushalmitMeduberet,ירושלים,מחזור ד,נשים | דתיים וחילונים,31.7683,35.2137,Jerusalem
מזרעה - חוות בארי מרכז קהילתי תחת כיפת שמיים,Mizra’a,"במהלך שנת הפעילות ה-2, פותח קונספט של 'מזרעה' במטרה לשים דגש על המפגש היהודי-ערבי. הפיילוט נחל הצלחה. בעקבות המצב החברתי הכללי והקיטוב והאיבה המתגברים בין הקהילות, התכנית הקרובה  התרחבה והיא מתוכננת ליצור תהליך משמעותי ועמוק יותר שבסופו המשתתפים יזמו יוזמות משותפות ברחבי הנגב וכך להעניק להם ידע בתחומים סביבתיים מגוונים והשראה ליכולת ההשפעה של יוזמות קהילתיות. כמו כן, גובש פורום של פעילים וארגונים מהנגב שעוסקים בדו-קיום, במטרה ליצור רשת של קשרים וחשיבה משותפת שבעזרתם ניתן לתמוך ביוזמות המשתתפים בתכנית.",publish,project,"כל רחבי הנגב ולכלול סיורים במגוון יזמויות סביבתיות בחברה הבדואית והיהודית. המפגש הראשון והאחרון יתקיימו בחוות בארי, בסיס הפעילות של שבועת האדמה בעיר העתיקה בבאר שבע, ומרכז לקהילת הקיימות של הנגב. במהלך התכנית מתוכננים מגוון סיורים בכפרים לא מוכרים, בבאר שבע, ירוחם ושגב שלום.",שבועת האדמה,https://www.2link.co.il/flipbook/lod-rtl,דרום,מחזור ד,צעירים וסטודנטים | יהודים וערבים | אנשי מקצוע ופעילים,31.125551,34.69402,
"מעגלים  מגוונים בקהילה יצירת שיח משתף בין קהילות דר' ת""א",Migvanim: a multicultural dialogue in the neighborhoods of south Tel Aviv,"מתוך יוזמה של משתתף בתכנית, בעקבות האירועים וההקצנה בשיח בחברה, הוקם פורום 'אחים אנחנו' שמשתתפים בו מובילי קהילה. נוצרו מפגשי דיאלוג ומפגש בין תושבים המגיעים מתפיסות עולם שונות, ומתוך בחירה לעסוק בחיבור, בהיכרות ובהדברות. והוקם מערך סיורים בשכונה מהזווית הרב תרבותית שמייצגת את המקום",publish,project,שכונת שפירא - במרכז הקהילתי,עמותת הפרדס,www.facebook.com/hapardestlv,מרכז,מחזור ד,צעירים וסטודנטים | דתיים וחילונים,32.048957,34.780242,
שוות ביחד,Shavot Beyachad - Equal together,"קידום שויון הזדמנויות וצמצום פערי מגדר, דרך חיזוק נערות ומתן כלים למימוש הפונטנציאל",publish,project,"רמלה,יפו ועכו",שוות,https://www.shavot.org/copy-of-%D7%A9%D7%95%D7%95%D7%AA-%D7%91%D7%9E%D7%93%D7%A2-%D7%95%D7%91%D7%98%D7%9B%D7%A0%D7%95%D7%9C%D7%95%D7%92%D7%99%D7%94,מרכז,מחזור ד,נוער וילדים | יהודים וערבים,31.9316,34.8729,Ramla
אדבר איתך - שתי שפות. אהבה אחת בהובלת תזמורת המהפכה ובשיתוף משרד החינוך,I Shall Speak to You - Two Languages. One Love.,"המיזם ""אדבר איתך"" מקרב בין בני נוער יהודים וערבים דרך לימוד שפה, שירה וחברה משותפת, בשיתוף משרד החינוך. בשיא התוכנית מתקיים מופע של תזמורת המהפכה ונגני נוער, המבצעים שירים בעברית ובערבית ככלי לעידוד סולידריות ורב-תרבותיות.",publish,project,"הפעילות כוללת שלושה חלקים: הראשון והאחרון הכוללים מערכי שיעור ופעילות בכיתה יתקיימו בביה""ס בהנחיית המורים, והשני - המופע, יתקיים בשעות ביה""ס באולם הופעות קרוב למיקום ביה""ס, כיציאה מאורגנת כיתתית לחוויית תרבות.",תזמורת המהפכה,https://www.rev-orch.com/%D7%90%D7%93%D7%91%D7%A8-%D7%90%D7%99%D7%AA%D7%9A-%D8%A3%D8%AA%D8%AD%D8%AF%D8%AB-%D8%A5%D9%84%D9%8A%D9%83/  https://www.rev-orch.com/i-shall-speak-to-you/,מרכז,מחזור ה,נוער וילדים | יהודים וערבים,32.121769,34.845025,
דג עוטף - 100 דגים מיסודה של הדג נחש,Hadag embraces,"סדרת כיתות אמן ייחודיות המשלבות מוזיקה, יצירה וטיפול רגשי ביישובי עוטף עזהמסגרת חדשנית לעיבוד חוויות המלחמה דרך כוחה המרפא של המוזיקה. שילוב מקצועי של מוזיקה וטיפול  הנחייה על ידי אמן מוביל מלהקת הדג נחש יחד עם מטפל רגשי. תהליך מובנה של 13 מפגשים",publish,project,"יישובי עוטף עזה - שדרות, מועצה אזורית שער הנגב ומועצה אזורית אשכול",100 דגים,https://www.100dagim.org/,דרום,מחזור ה,נוער וילדים,31.334167,34.399742,
