post_title,post_name_en,post_content,post_status,post_type,location,operating_org,project_link,geographic_region,recruitment_cycle,target_audience,latitude,longitude,coordinate_source
הוילג' - בית הנשים,The Village,"הוילג' הוא מועדון אימפקט לנשים המשלב מעורבות חברתית שכונתית, קהילה רב תרבותית ומרחב עבודה וצמיחה משותף לעצמאיות ובעלות עסקים קטנים. הוילג' משמש פלטפורמה לחיבורים מקומיים, נטוורקינג ומעודד מנהיגות נשית מקומית.",publish,project,חיפה,גיוינג,https://thevillagehaifa.com/,כרמל,מחזור ה,נשים | יהודים וערבים,32.807158,35.004156,
העצמה ובניית חוסן אישי בקרב צעירי החברה הערבית בלוד,Empowerment and building personal resilience among the youth of the Arab community in Lod to strengthen the fabric of coexistence.,"פעילות בת 7 חודשים במהלכם נבנה מחדש את החוסן הנפשי של הצעירי, העצמת הדימוי העצמי שלהם והכנת הצעירים לניהול דיאלוג משותף בקהילה מעורבת יהודים ערבים ואתיופיים",publish,project,לוד,אזרחים בונים קהילה,https://www.facebook.com/Mowatinon?mibextid=ZbWKwL,מרכז,מחזור ה,צעירים וסטודנטים,31.937114,34.903293,
התכנית לסטודנטים מצטיינים במערכת החינוך לצמיחה חברתית וחיבור בין הקבוצות השונות בחברה הישראלית,Yessodot Center - Students for Public Service in the Ministry of Education,"תכנית בוטיק להכשרה, ליווי ושימור סטודנטים וסטודנטיות מצטיינים במשרד החינוך להשתלבות בתפקידים משמעותיים במערכת החינוך והעלאת מוטיבציה להמשך עשייה בשירות המדינה ובשירות הציבורי",publish,project,ירושלים,מרכז מעשה,https://www.facebook.com/search/top?q=%D7%9E%D7%A8%D7%9B%D7%96%20%D7%99%D7%A1%D7%95%D7%93%D7%95%D7%AA%20%D8%A3%D9%8F%D8%B3%D8%B3,מרכז,מחזור ה,צעירים וסטודנטים,31.957785,34.928428,
להתחיל ב800,Start 800,"המיזם הופך את מסגרות החינוך הבלתי פורמלי להזדמנות לחינוך לערכי סובלנות וסולידריות באמצעות הכשרת צוותים ותוכנית פדגוגית ייעודית. בשיתוף פעולה עם הרשויות המקומיות, אנו מקנים לילדים בגילאי 4 עד 9 כלים לחיים משותפים וקבלת האחר בצהרונים ובקייטנות.",publish,project,"בשנת הלימודים תשפ""ד הפעלנו שתי תוכניות פיילוט: הפיילוט הראשון בראש העין כלל צהרונים של 10 גנים מתוכם שניים ממלכתי דתי ושמונה ממלכתי. הפיילוט השני בחריש כלל צהרונים של שתי כיתות גן ו- 5 כיתות בית ספר (א' וב'). בשנת תשפ""ה השאיפה היא להרחיב את מספר הצהרונים בראש העין וחרי ולהיכנס בפיילוטים לעוד 2 רשויות נוספות.","הזנק 800 בע""מ",https://www.start800.org.il/,כרמל,מחזור ה,נוער וילדים,32.457808,35.048944,
"לשתף בכאב, ליצור תקווה","Sharing Pain, Creating Hope","המיזם בא לחבר בין הכאב האישי, המשפחתי, הקהילתי והחברתי שנוצר בשבעה באוקטובר לבין התקווה של יצירת מציאות אחרת – מבוססת כבוד האדם, שיתוף פעולה, וצמיחה מהאבל.",publish,project,אירוע ההשקה יתקיים בירושלים. המיזם עצמו יתקיים בכל רחבי הארץ עם דגש על הנגב המערבי,אתגר. עמותה להתמרת סכסוכים,https://www.facebook.com/share/JbdTTPRQ6WxQxWSY/?mibextid=xfxF2i,דרום,מחזור ה,יהודים וערבים,31.373067,34.666807,
מובילות חיבור,Movilot Connections,"ארגון ""מובילות חיבור"" מקדם מנהיגות תעסוקתית נשית חרדית כגשר בין מגזרי להפחתת הקיטוב בחברה הישראלית. באמצעות תהליכי מנטורינג וחיבורים בארגונים עסקיים, המיזם רותם נשים ליצירת השפעה וסולידריות חברתית.",publish,project,ארצי,"English: The ""Movilot Chibur"" (Movilot Connection) initiative empowers Haredi women leaders to bridge social gaps and reduce polarization in Israel. By leveraging the influence of women in the business sector, the project fosters sustainable connections and social solidarity.",www.movilot.org.il,מרכז,מחזור ה,נשים | דתיים וחילונים,32.094695,34.853029,
"מרחב רב תרבותי בבי""ס תווים לילדי לוד על הרצף האוטיסטי",אין מידע,,publish,project,,,,מרכז,מחזור ה,מוגבליות,31.938518,34.883473,
נשות ירושלים,The Women of Jerusalem,"""נשות ירושלים"" היא תוכנית מנהיגות ומדיה המפתחת הבנה הדדית בין נשים חרדיות, חילוניות וממזרח העיר. המיזם בונה רשת של מנהיגות נשית המשתמשת בכלי תקשורת ודיאלוג כדי לקדם זהות משותפת והובלת שינוי חברתי.",publish,project,מזרח ומערב ירושלים,0202 נקודת מבט מירושלים,https://drive.google.com/file/d/1ojStM7BpIii8QLctyG5MIKA16FmcDOri/view?usp=drive_link      https://www.facebook.com/0202updates   https://0202updates.org/,ירושלים,מחזור ה,נשים | יהודים וערבים,31.774375,35.234442,
ערבות,Arvut,"תוכנית ערבות היא תוכנית מנהיגות לסטודנטים שמגיעים מרקעים ומערכות חינוך שונות. התוכנית מקנה ביסוס רעיוני, כלים ותיאוריה יהודית על צדק חברתי וזהות יהודית-חברתית",publish,project,מקומות שונים בירושלים ובמרכז למורשת יהדות סלוניקי בבר אילן.,מעגלי צדק,https://www.facebook.com/MaagaleiTzedek?mibextid=LQQJ4d,ירושלים,מחזור ה,צעירים וסטודנטים,31.780359,35.206738,
קבוצות לימוד בין דתיות,Interfaith study groups,"הפרוייקט פונה לסוכני שינוי בעלי יכולת השפעה במעגלים רחבים בחברה הישראלית. קהל יעד זה כולל: רבנים, מחנכים, אימאמים, שייח'ים וראשי כנסיה וקהילות בישראל.",publish,project,"המיזם יפעל בפריסה ארצית על בסיס שלוש קבוצות עבודה מרכזיות, מתוכן שתיים תפעלנה באופן אזורי (כגון בצפון ובדרום) ואחת תפעל באופן כלל-ארצי ותתפקד גם כועדת ההיגוי של המיזם.מקומות המפגש הפיזיים יבחרו בהמשך בהתאם להעדפות המשתתפים והמשתתפות",המרכז הבין דתי אור התורה,https://www.facebook.com/profile.php?id=61557545967137&locale=he_IL,ירושלים,מחזור ה,דתיים וחילונים,31.750144,35.201941,
שותפות בתנועה,Partnership in Movement,"מיזם משותף לארגון אג'יק ותנועת הצופים, במסגרתו רכזים משני הארגונים עוברים קורס הנחיית דיאלוג במהלך השנה ומובילים מפגשים משמעותיים בין קבוצות יהודיות וערביות ברחבי הארץ, של חניכי תנועות הנוער ושנות מעבר יחד עם מתנדבי שנת שירות. במסגרת המפגשים הקבוצות יוצרות מיזמים משותפים לטובת האזור בו הם חיים.",publish,project,פרויקט ארצי,אג'יק מכון הנגב ותנועת הצופים,https://ajeec-nisped.org.il/?page_id=22053&lang=en,דרום,מחזור ה,נוער וילדים | אנשי מקצוע ופעילים,31.256361,34.814525,
שכנות טובה,Good Neighborship Project,"מפגש חודשי לאורך שנת הלימודים של בני ובנות נוער בדואים-יהודים החיים בהר הנגב. סדרת המפגשים מבוססת על ערכים משותפים ומטרתה להקטין זרות, לסלק דעות קדומות וגילויי גזענות, וליצור קשרים חברתיים חוצי מגזרים בין המשתתפים ובין הקהילות שלהם.",publish,project,"אזור הר הנגב (בין מדרשת בן גוריון למצפה רמון). הפעילות מתקיימות בישובי הר הנגב, יהודים ובדואים, על מנת להכיר את החיים, התרבות והמנהגים המאפיינים את הקהילות בישובים השונים.","קשת- קהילה , תרבות , סביבה",https://keshet.org.il/projects/good-neighborliness/   https://keshet.org.il/en/projects/good-neighbor-ship-project/,דרום,מחזור ה,נוער וילדים | יהודים וערבים,30.736434,34.806579,
תוואסול - מתחברים,"Tawasel (Arabic for connected) - An inspiring, hopeful Bedouin experience.","מיזם ""תוואסל"" של עמותת Desert Stars מחבר בין מנהיגות צעירה בחברה הבדואית לחברה הישראלית הרחבה לקידום דיאלוג ושותפות בנגב. באמצעות היכרות מעמיקה עם אתגרי האזור, התוכנית מחזקת את האמונה בשותפות יהודית-ערבית כבסיס לשינוי חברתי בר-קיימא.",publish,project,"מקומות רבים ברחבי הנגב, או הרצאות במקום משלכם.",כוכבי המדבר,https://www.desertstars.org.il/homepage-english,דרום,מחזור ה,יהודים וערבים | נוער וילדים,31.104235,34.879645,
ביחד למען משאב אזורי - שותפות להצלת ים המלח,Together for a Regional Treasure - Partnership to Save the Dead Sea,"הפרויקט מתמקד ביצירת קהילת מאבק רב-תרבותית להצלת ים המלח, תוך שילוב צעירים יהודים וערבים בשיתוף פעולה סביבתי וקידום דיאלוג בין-תרבותי",publish,project,ים המלח,מגמה ירוקה,https://www.green.org.il/,דרום,מחזור ה,צעירים וסטודנטים | יהודים וערבים,30.984931,35.35489,
"בניא (bunya) – לומדים לתקשר, להכיר ולהתחבר – הכשרת פעילים חברתיים",Binaya - Social activists learn to communicate,"הכשרת פעילים חברתיים בארץ לקידום הקשבה, שפה ועבודה משותפת בשגרה ובמצבי קיצון",publish,project,ירושלים,מדרסה - לומדים לתקשר,www.madrasafree.com,ירושלים,מחזור ה,יהודים וערבים | אנשי מקצוע ופעילים,31.764503,35.222947,
ג’ודו עם שכנים,Judo with neighbors,"הפרויקט מחבר בין ילדים ונוער ממועצות שכנות יהודיות וערביות דרך ענף הג'ודו, במטרה לבנות תשתית ספורטיבית משותפת בנגישות שווה. באמצעות אימונים ומפגשים, המיזם רותם את ערכי הספורט לאיחוד בין הקהילות, לחיזוק הקשרים ולקידום כבוד הדדי.",publish,project,"אימוני הג'ודו מתקיימים במועדון הג'ודו שבקיבוץ עין דור. אימוני החשיפה ואימונים מיוחדים מתקיימים במתנ""ס בכפר מצר. הפעילות החברתית הנוספת מתקיימת במוזיאון עין דור.","מ.א עמק יזרעאל, מוזיאון עין דור ומתנ""ס בוסתן אל מרג' שהוא ארגון הגג של המיזם.",,צפון,מחזור ה,נוער וילדים |יהודים וערבים,32.659913,35.425806,
"חברתי - ארץ, עיר, שכונה ובית","Our community - country, city, neighborhood and home",תערוכה פעילה של אמנים ישראלים במסגרתה מוצגות יצירות העוסקות בתמה חברתית ובערכים של הקשבה וסובלנות תוך כבוד ושמירה על ייחודיות של כל קהילה. לצד היצירות המוצגות בתערוכה משולבות פעילויות חינוכיות למבקרים במטרה לגשר על פערים חברתיים ולקדם שיח סובלנות והדהוד חשיבותה של האחדות,publish,project,"בגלריה במרכז אמנויות ע""ש אפטר-ברר, מעלות תרשיחא עם אפשרות הנדדת התערוכה למקומות נוספים ברחבי הארץ","מרכז אמנויות וגלריה ע""ש אפטר-ברר, מעלות-תרשיחא", www.artsmaalot.com,צפון,מחזור ה,נוער וילדים | יהודים וערבים,33.013626,35.285812,
מקהלת ראנה- מקהלת הנשים הערבית-יהודית ביפו,Rana Choir,"מקהלת ""ראנה"" מיפו מפגישה נשים מוסלמיות, נוצריות ויהודיות ליצירת גשר תרבותי דרך שירה ודיאלוג נשי משותף. באמצעות רפרטואר רב-לשוני ומופעים, המקהלה מציגה מודל לחיים משותפים ומבטאת תקווה לשלום ולשותפות גורל אנושית.",publish,project,יפו,מרכז פליציה בלומנטל למוזיקה,https://ranachoir.com/en/home-page-english/ ,מרכז,מחזור ה,נשים | יהודים וערבים,32.073121,4.77124,
פיתוח תוכן יעודי להכשרות מורים בתחום שיקום היחסים בין קבוצות בחברה הישראלית,Promoting education to reduce prejudice and racism,"פיתוח יחידת תוכן וכתיבת חוברת למורה בעברית ובערבית בהושא דעות קדומות וגזענות, שיוטמעו בכל הכשרות מצמיחים המשותפות למורים יהודים וערבים המתקיימות מדי שנה",publish,project,"מוסדות אקדמיים להכשרת מורים, מרכזי פסג""ה ומה""דים בכל רחבי הארץ.",מצמיחים-המרכז להפחתת אלימות בבתי ספר,https://matzmichim.org.il,מרכז,מחזור ה,יהודים וערבים | אנשי מקצוע ופעילים,32.078932,34.885549,
שותפות ערבית-יהודית חוף הכרמל - ארוע אופני שטח בפרדיס,The Arab-Jewish Carmel villages partnership,"פעילות קהילתית באזור חוף הכרמל, שהוקמה בעקבות אירועי מאי 2021, במטרה ליצור קהילה אקטיביסטית ערבית-יהודית משותפת. המיזם מקיים מגוון אירועי תרבות, ספורט וסיוע לנזקקים, הפועלים לחיזוק השותפות ושיפור המצב המשותף באזור",publish,project,"בכל מרחב הפעילות. המרכז לאירועים שלנו הוא מתחם המעיין באזור התעשייה מעיין צבי, אך אירועים מתרחשים בפרדיס, ג'יסר א זרקא ועוד.",עמותת מבט,https://www.facebook.com/shirakarmel/?paipv=0&eav=AfbE6zcBnTCCKVjFPo08bBCu39a-GiF-Ozxdb9_mRv7A44uWa3yBZo8cLi7BReqf5mM&_rdr,כרמל,מחזור ה,יהודים וערבים | קהל מגוון,32.606547,34.94035,
המשך - אקלים של אחדות,Climate of Unity,"קהילות צעירים המורכבות מחילוניים ודתיים, אשר לומדות, עוסקות ופועלות בתחום הקיימות. הקהילה מקיימת אירועי תרבות הפתוחים לקהל הרחב, ערבי לימוד, סדנאות, קבלות שבת, ארוחות שישי וסמינרים. בנוסף, חלק מחברי הקהילה לוקחים על עצמם משימה חינוכית ועוסקים בקידום מנהיגות סביבתית במסגרות קדם צבאיות ברחבי הארץ.",publish,project,,,,ירושלים,מחזור ה,צעירים וסטודנטים | דתיים וחילונים,31.779247,35.214493,
הליכות דאלוגיות במרחב השכונתי / עירוני BEDO,Paving the Way,"פיתוח היכולת להוביל צוותים וקבוצות במציאות מקוטבת, דרך היכרות עם עקרונות וכלים מגישת ה-U, הנגשת הכלים באופן מותאם ליישום מיידי, ופיתוח תובנות של המשתתפים ביחס לעצמם ולמרחב שבו הם פועלים.",publish,project,,,,מרכז,מחזור ה,אנשי מקצוע ופעילים,,,
חממה לחיים משותפים בארגוני הנוער,The Shared Society Incubator in Youth Organizations,"התוכנית מקדמת לכידות חברתית וחיים משותפים בארגוני נוער דרך למידה עיונית ויישום פרויקטים שנתיים בשטח. באמצעות הקמת ""מיני חממה"" ופיתוח פדגוגיה ייעודית, המיזם מטמיע ערכי שותפות בקרב בעלי תפקידים להרחבת ההשפעה בארגון.",publish,project,,,,מרכז,מחזור ה,נוער וילדים,,,
חממת יזמות תרבות-תיירות לנשים יוצרות בחברה הבדואית בנגב סטודיו משלך,Studio Mishelach - The center of Women's Art  in Jerusalem,"""סטודיו משלך"" הוא מרחב וקהילה לנשים אמניות המקדם שיח רב-תרבותי ושינוי חברתי דרך אמנות עכשווית ופרויקטים במרחב הציבורי. המרכז מציע גלריה, סדנאות ותוכנית מנטורינג ייחודית לקידום אמניות מהמגזר החרדי, הערבי והבדואי ליצירת גשרים בין אוכלוסיות בירושלים.",publish,project,,,,מרכז,מחזור ה,נוער וילדים | נשים,,,
מעגלי חיכאיאת (סיפורים),Maagaley Hikayat - Jewish and Arab women tell a new story in the Galilee,"מיזם ""חיכאיאת"" מחבר בין נשים דרך אמנות סיפור הסיפורים, הכשרות מקצועיות ותיעוד סיפורי ""חיים משותפים"" בעברית ובערבית. בשנת 2025 יתרחב המיזם להקלטת פודקאסטים, תחרויות כתיבה והקמת ""אוהל מספרות"" בפסטיבלים לקידום דיאלוג רב-תרבותי.",publish,project,,,https://hikayat.co.il/,מרכז,מחזור ה,נשים | יהודים וערבים,,,
מעגל סבאיא –  מעגל נשים שותפות,Sharaka - Women's circle Partnership,"מעגלי נשים לסטודנטיות יהודיות וערביות ממכללת תל חי. הפעילות כוללת גם סמינר, מפגש עם קבוצות אחרות, סיורי העמקה ושותפות ברשת הבוגרים של תוכניות ""זרעים של שותפות""",publish,project,,,,מרכז,מחזור ה,צעירים וסטודנטים,,,
נפגשים בשבילי אברהם אבינו,Meeting on the paths of Abraham our father,"מפגש והכרות מעמיקה של השפה, התרבות והמסורות הערבית לצעירים יהודים מקהילות שמרניות",publish,project,,,,מרכז,מחזור ה,צעירים וסטודנטים | יהודים וערבים,,,
על המקאם הזה: אמנות התרגום כאפשרות למפגש,Al Hamakam Haze (About this Place): Finding common ground through the Art of Translation,"על המקאם הזה היא תוכנית שנתית שמטרתה מפגש פואטי קבוע ומתמשך בין יוצרים ערבים ויהודים, שימוש בפרקטיקות התרגום ככלי לדיאלוג דו לשוני עמוק והיכרות רחבה יותר עם שתי השפות.",publish,project,,,,מרכז,מחזור ה,יהודים וערבים,,,
שיח נשי יהודי מוסלמי  יוזמות תקווה,Women envision hope,הקמת קבוצות מקומיות של נשים יוזמות תקווה ועשייה קהילתית מותאמת לשטח,publish,project,,,,מרכז,מחזור ה,נשים | יהודים וערבים,,,
שוף אל נוף - מיזם טיולים משותפים,Shouf el Nof - Community-Based Cultural Heritage Tourism Development,"15 יזמים חברתיים, יהודים וערבים, ישתתפו בתוכנית לפיתוח תיירות קהילתית ויקיימו סיורים רב-תרבותיים באזור חוף הכרמל, זכרון יעקב והסביבה. היזמים יובילו סיורי פיילוט ויקימו מערך שיווק משותף שמטרתו לחזק ולספר את הנרטיב האזורי המשותף.",publish,project,,,,מרכז,מחזור ה,יהודים וערבים | אנשי מקצוע ופעילים,,,
שכונת הפסיפס,Mosaic Neiborhood,"הפרויקט מציע יצירת פסיפסים קהילתיים ומשפחתיים המבטאים זהויות מגוונות לצד חיבור לזהות משותפת אחת. היצירות יוצגו במרחב הציבורי ויהפכו את השכונה למוקד של גאווה מקומית, עניין ותחושת שייכות עירונית ולאומית.",publish,project,מוזיאון פסיפס לוד,"אדרבה לוד המרכז למורשת התנאים ע""ר  מוזיאון פסיפס לוד - מוניקס",,מרכז,מחזור ו,קהל מגוון,,,
חִבּוּרֵי יַלְדוּת,Early Childhood Bonds,"מיזם ""חיבורי ילדות"" נועד לחזק את הלכידות החברתית בין הקהילות והצוותים החינוכיים בישראל דרך התמקדות במשותף. המיזם כולל מפגשי צוות ואירועי שיא עם הורים וילדים סביב נושאי ילדות נוסטלגיים כמו משחקים, שירים וחלומות",publish,project,"מיזם ""חיבורי ילדות"" פועל במעונות יום, צהרונים ומרכזי הורות ומשפחה של החברה למתנ""סים, 10 קבוצות בפריסה ארצית.",האגודה לעידוד מרכזים קהילתיים בישראל,https://www.matnasim.org.il/program/bakehila,מרכז,מחזור ו,נוער וילדים | יהודים וערבים | אנשי מקצוע ופעילים,,,
במה משותפת - תיאטרון לקירוב לבבות,shared stage- atheater that bring hearts closer,מפגשים של קבוצת ילדים יהודים וערבים שיצרו יחד בתהליך קבוצתי ויצרו יחד,publish,project,תיאטרון אלמינא החדש בנמל יפו . תיאטרון עם חזון במטרה לעורר השראה ולגשר ולתווך למען קיום משותף דרך אמנויות הבמה,עמותת אלמינא - בית ליוצרים,www.elminajaffa.com,מרכז,מחזור ו,נוער וילדים | יהודים וערבים,32.051297,34.74933,
אקוסיסטם הבוסתן לתמיכה בחברה משותפת,Bustan,"מיזם ""הבוסתן"" פועל לביסוס קהילה ומנהיגות ערבית-יהודית משותפת בנוף הגליל באמצעות מפגשים ואירועים קהילתיים. המיזם בונה שותפויות רב-מגזריות עם גופי ממשל, אקדמיה וחברה אזרחית כדי ליצור מערכת תומכת לחברה משתפת.",publish,project,נוף הגליל,"תיקון- מרכז לחינוך, מפגש ושינוי חברתי",https://www.facebook.com/bustan.sharedcommunity/?locale=he_IL,צפון,מחזור ו,נוער וילדים | נשים,32.717647,35.34611,
לחיות ביחד,living Together,"הפרויקט יוצר רצף של מפגשי העמקה, סדנאות על זהות ותרבות, ביקורים הדדיים, ולבסוף פרויקט חברתי משותף שנבחר ומבוצע יחד על ידי המשתתפים - תרומה מוחשית לחברה, המדגישה את הערכים של שותפות, אחריות ואזרחות פעילה.",publish,project,"צפון הארץ, יבנה",נוער מוביל שינוי,://aharai.org.il /,צפון,מחזור ו,נוער וילדים | יהודים וערבים,32.795866,35.332191,
רוקמות שותפות,"“Embroidering Partnership""","המיזם מפגיש נשים בדואיות רוקמות, מעצבות מפולין וסטודנטים משנקר לעיצוב  קולקציית אופנת עילית משותפת, תוך עבודה משולבת ב”הנגריה” ביד מרדכי ובכפרים הבדואיים. הפעילות כוללת עיצוב, תפירה, תערוכות, סדנאות והרצאות המקדמות דו-קיום, שימור מורשת והעצמה קהילתית",publish,project,קיבוץ יד מרדכי,תוויתא מנגינה,,דרום,מחזור ו,צעירים וסטודנטים | נשים | יהודים וערבים,31.587409,34.560902,
